{"body_ref":"cluster:legion:compaii","content_hash":"8114c42cda100c71f7a2d501576457ca27f44fd2b408cf449f7b9b7ca901d9b9","epoch":7,"expires_at_ms":1800000001000,"holder_embodiment_id":"embodiment:legion","holder_incarnation_id":"incarnation:legion:0","observed_at_ms":1799999999900,"resource_ref":"wiki:page:home","schema":"dm.cluster-resource-fence-evidence/v1","verification_ref":"cluster-proof:synthetic-7"}